{
  "schema_version": 1,
  "citations": [
    {
      "id": "cite-1910.10739-1811.04083",
      "from_paper_id": "arxiv:1910.10739v5",
      "cited_arxiv_id": "1811.04083",
      "cited_version": null,
      "reference": "12",
      "source": {
        "role": "html",
        "sha256": "1f6e23feb42188d99739287090d4078e8adf998e06e0db34cd9c361549eeb895",
        "locator": "HTML References: [12]; bib.bib12; PDF reference [12]",
        "url": "https://arxiv.org/html/1910.10739v5#bib.bib12"
      }
    },
    {
      "id": "cite-2605.26116-1811.04083",
      "from_paper_id": "arxiv:2605.26116v2",
      "cited_arxiv_id": "1811.04083",
      "cited_version": null,
      "reference": "59",
      "source": {
        "role": "html",
        "sha256": "f28f0ffce5f4441e7670fedbcfe48e88dbfdde9f2449a0dfb4b7ae4aacb973fb",
        "locator": "HTML References: Poulin et al. (2019); bib.bib58; PDF reference [59]",
        "url": "https://arxiv.org/html/2605.26116v2#bib.bib58"
      }
    },
    {
      "id": "cite-2605.26116-2202.08291",
      "from_paper_id": "arxiv:2605.26116v2",
      "cited_arxiv_id": "2202.08291",
      "cited_version": null,
      "reference": "94",
      "source": {
        "role": "html",
        "sha256": "f28f0ffce5f4441e7670fedbcfe48e88dbfdde9f2449a0dfb4b7ae4aacb973fb",
        "locator": "HTML References: Sabla and Caldwell (2022); bib.bib93; PDF reference [94]",
        "url": "https://arxiv.org/html/2605.26116v2#bib.bib93"
      }
    },
    {
      "id": "cite-2605.26116-2408.03229",
      "from_paper_id": "arxiv:2605.26116v2",
      "cited_arxiv_id": "2408.03229",
      "cited_version": null,
      "reference": "239",
      "source": {
        "role": "html",
        "sha256": "f28f0ffce5f4441e7670fedbcfe48e88dbfdde9f2449a0dfb4b7ae4aacb973fb",
        "locator": "HTML References: Sohail et al. (2025a); bib.bib232; PDF reference [239]",
        "url": "https://arxiv.org/html/2605.26116v2#bib.bib232"
      }
    },
    {
      "id": "cite-2503.14738-1807.06209",
      "from_paper_id": "arxiv:2503.14738v3",
      "cited_arxiv_id": "1807.06209",
      "cited_version": null,
      "reference": "24",
      "source": {
        "role": "html",
        "sha256": "782d7b25d5a6d7195e0dc0cfdab029e49a4b05cff8263e18f843e82e9c054c49",
        "locator": "HTML bibliography [24]; bib.bib24; base arXiv identity only",
        "url": "https://arxiv.org/html/2503.14738v3#bib.bib24"
      }
    },
    {
      "id": "cite-2503.14738-2112.03863",
      "from_paper_id": "arxiv:2503.14738v3",
      "cited_arxiv_id": "2112.03863",
      "cited_version": null,
      "reference": "29",
      "source": {
        "role": "html",
        "sha256": "782d7b25d5a6d7195e0dc0cfdab029e49a4b05cff8263e18f843e82e9c054c49",
        "locator": "HTML bibliography [29]; bib.bib29; base arXiv identity only",
        "url": "https://arxiv.org/html/2503.14738v3#bib.bib29"
      }
    },
    {
      "id": "cite-2503.14738-2202.04077",
      "from_paper_id": "arxiv:2503.14738v3",
      "cited_arxiv_id": "2202.04077",
      "cited_version": null,
      "reference": "113",
      "source": {
        "role": "html",
        "sha256": "782d7b25d5a6d7195e0dc0cfdab029e49a4b05cff8263e18f843e82e9c054c49",
        "locator": "HTML bibliography [113]; bib.bib113; base arXiv identity only",
        "url": "https://arxiv.org/html/2503.14738v3#bib.bib113"
      }
    },
    {
      "id": "cite-2503.14738-2112.04510",
      "from_paper_id": "arxiv:2503.14738v3",
      "cited_arxiv_id": "2112.04510",
      "cited_version": null,
      "reference": "129",
      "source": {
        "role": "html",
        "sha256": "782d7b25d5a6d7195e0dc0cfdab029e49a4b05cff8263e18f843e82e9c054c49",
        "locator": "HTML bibliography [129]; bib.bib129; base arXiv identity only",
        "url": "https://arxiv.org/html/2503.14738v3#bib.bib129"
      }
    },
    {
      "id": "cite-2202.04077-2112.03864",
      "from_paper_id": "arxiv:2202.04077v2",
      "cited_arxiv_id": "2112.03864",
      "cited_version": null,
      "reference": "12",
      "source": {
        "role": "html",
        "sha256": "7580cd8300bf5bf53119735a06c94f7240a7426c37a4f2e8fdbf9915905ecb38",
        "locator": "HTML bibliography [12]; bib.bib12; base arXiv identity only",
        "url": "https://arxiv.org/html/2202.04077v2#bib.bib12"
      }
    },
    {
      "id": "cite-2202.04077-1807.06209",
      "from_paper_id": "arxiv:2202.04077v2",
      "cited_arxiv_id": "1807.06209",
      "cited_version": null,
      "reference": "29",
      "source": {
        "role": "html",
        "sha256": "7580cd8300bf5bf53119735a06c94f7240a7426c37a4f2e8fdbf9915905ecb38",
        "locator": "HTML bibliography [29]; bib.bib29; base arXiv identity only",
        "url": "https://arxiv.org/html/2202.04077v2#bib.bib29"
      }
    },
    {
      "id": "cite-2202.04077-2112.04510",
      "from_paper_id": "arxiv:2202.04077v2",
      "cited_arxiv_id": "2112.04510",
      "cited_version": null,
      "reference": "95",
      "source": {
        "role": "html",
        "sha256": "7580cd8300bf5bf53119735a06c94f7240a7426c37a4f2e8fdbf9915905ecb38",
        "locator": "HTML bibliography [95]; bib.bib95; base arXiv identity only",
        "url": "https://arxiv.org/html/2202.04077v2#bib.bib95"
      }
    },
    {
      "id": "cite-2202.04077-2112.03863",
      "from_paper_id": "arxiv:2202.04077v2",
      "cited_arxiv_id": "2112.03863",
      "cited_version": null,
      "reference": "112",
      "source": {
        "role": "html",
        "sha256": "7580cd8300bf5bf53119735a06c94f7240a7426c37a4f2e8fdbf9915905ecb38",
        "locator": "HTML bibliography [112]; bib.bib112; base arXiv identity only",
        "url": "https://arxiv.org/html/2202.04077v2#bib.bib112"
      }
    },
    {
      "id": "cite-2112.03864-2202.04077",
      "from_paper_id": "arxiv:2112.03864v2",
      "cited_arxiv_id": "2202.04077",
      "cited_version": null,
      "reference": "13",
      "source": {
        "role": "html",
        "sha256": "5e042f44faa5204afb941c9e8914d6920409a67429673bc8ac01e6c990265805",
        "locator": "HTML bibliography [13]; bib.bib13; base arXiv identity only",
        "url": "https://arxiv.org/html/2112.03864v2#bib.bib13"
      }
    },
    {
      "id": "cite-2112.03864-1807.06209",
      "from_paper_id": "arxiv:2112.03864v2",
      "cited_arxiv_id": "1807.06209",
      "cited_version": null,
      "reference": "23",
      "source": {
        "role": "html",
        "sha256": "5e042f44faa5204afb941c9e8914d6920409a67429673bc8ac01e6c990265805",
        "locator": "HTML bibliography [23]; bib.bib23; base arXiv identity only",
        "url": "https://arxiv.org/html/2112.03864v2#bib.bib23"
      }
    },
    {
      "id": "cite-2112.03864-2112.04510",
      "from_paper_id": "arxiv:2112.03864v2",
      "cited_arxiv_id": "2112.04510",
      "cited_version": null,
      "reference": "67",
      "source": {
        "role": "html",
        "sha256": "5e042f44faa5204afb941c9e8914d6920409a67429673bc8ac01e6c990265805",
        "locator": "HTML bibliography [67]; bib.bib67; base arXiv identity only",
        "url": "https://arxiv.org/html/2112.03864v2#bib.bib67"
      }
    },
    {
      "id": "cite-2112.03864-2112.03863",
      "from_paper_id": "arxiv:2112.03864v2",
      "cited_arxiv_id": "2112.03863",
      "cited_version": null,
      "reference": "74",
      "source": {
        "role": "html",
        "sha256": "5e042f44faa5204afb941c9e8914d6920409a67429673bc8ac01e6c990265805",
        "locator": "HTML bibliography [74]; bib.bib74; base arXiv identity only",
        "url": "https://arxiv.org/html/2112.03864v2#bib.bib74"
      }
    },
    {
      "id": "cite-2609.36853-1807.06209",
      "from_paper_id": "arxiv:2609.36853v1",
      "cited_arxiv_id": "1807.06209",
      "cited_version": null,
      "reference": "4",
      "source": {
        "role": "html",
        "sha256": "ba0c79c9a1404936a9b3b4524cf3134e7352a21c53d5e58c6cf58865d1eebcd5",
        "locator": "HTML References [4], bib.bib4; PDF reference [4], p. 8",
        "url": "https://arxiv.org/html/2609.36853v1#bib.bib4"
      }
    },
    {
      "id": "cite-2609.36853-1812.04589",
      "from_paper_id": "arxiv:2609.36853v1",
      "cited_arxiv_id": "1812.04589",
      "cited_version": null,
      "reference": "30",
      "source": {
        "role": "html",
        "sha256": "ba0c79c9a1404936a9b3b4524cf3134e7352a21c53d5e58c6cf58865d1eebcd5",
        "locator": "HTML References [30], bib.bib30; PDF reference [30], p. 8",
        "url": "https://arxiv.org/html/2609.36853v1#bib.bib30"
      }
    },
    {
      "id": "cite-2609.37437-2503.14738",
      "from_paper_id": "arxiv:2609.37437v1",
      "cited_arxiv_id": "2503.14738",
      "cited_version": null,
      "reference": "3",
      "source": {
        "role": "html",
        "sha256": "62b0a576adfec55caf1e6344d6c4eae4a0a099c16a4111f2babb5d952b973883",
        "locator": "HTML bibliography [3]; bib.bib53; PDF numeric reference [3]; printed base ID without version",
        "url": "https://arxiv.org/html/2609.37437v1#bib.bib53"
      }
    },
    {
      "id": "cite-2609.37437-1807.06209",
      "from_paper_id": "arxiv:2609.37437v1",
      "cited_arxiv_id": "1807.06209",
      "cited_version": null,
      "reference": "6",
      "source": {
        "role": "html",
        "sha256": "62b0a576adfec55caf1e6344d6c4eae4a0a099c16a4111f2babb5d952b973883",
        "locator": "HTML bibliography [6]; bib.bib37; PDF numeric reference [6]; printed base ID without version",
        "url": "https://arxiv.org/html/2609.37437v1#bib.bib37"
      }
    },
    {
      "id": "cite-1104.2933v3-astro-ph__9603033",
      "from_paper_id": "arxiv:1104.2933v3",
      "cited_arxiv_id": "astro-ph/9603033",
      "cited_version": null,
      "reference": "[2]",
      "source": {
        "role": "html",
        "sha256": "b078d2fc319cbc381d887dcbc1e015950c4a98712eb86530ca75dcb69d442509",